title                                                           ,url                                                                                                ,description                                                                                                                                                                                                                         ,content
Chó robot bắt bóng                                              ,https://vnexpress.net/cho-robot-bat-bong-4811129.html                                              ,MỹCác nhà khoa học tại Học viện công nghệ MIT phát triển chó robot có thể chơi bóng đá nhờ kết hợp giữa trí tuệ nhân tạo (AI) và thị giác máy tính.                                                                                 ,"Chó robot chơi trò đá bóng. Video: Live Science Các nhà nghiên cứu tại Massachusetts Institute of Technology (MIT) phát triển một phương pháp có tên là ""Clio"", cho phép robot nhanh chóng lập bản đồ một khung cảnh bằng cách sử dụng camera gắn trên thân và xác định các phần liên quan nhất đến nhiệm vụ chúng được giao thông qua hướng dẫn bằng giọng nói. Nghiên cứu công bố trên tạp chí IEEE Robotics and Automation Letters, hôm 10/10. Clio khai thác lý thuyết về ""nút thắt thông tin"", theo đó thông tin được nén lại để mạng nơ-ron, một tập hợp các thuật toán học máy được phân lớp để bắt chước cách bộ não con người xử lý thông tin, chỉ chọn và lưu trữ các phân đoạn có liên quan. Bất kỳ robot nào được trang bị hệ thống này sẽ xử lý các hướng dẫn một cách chọn lọc, tập trung vào nhiệm vụ của nó và bỏ qua mọi thứ khác. Ví dụ, giả sử có một chồng sách trong khung cảnh và nhiệm vụ chỉ lấy cuốn sách màu xanh lá cây. Trong trường hợp đó, tất cả thông tin về khung cảnh này được đẩy và kết thúc bằng một cụm các phân đoạn đại diện cho cuốn sách màu xanh lá cây, đồng tác giả nghiên cứu Dominic Maggio, một nghiên cứu sinh tại MIT, cho biết. ""Tất cả các phân đoạn khác không liên quan được nhóm lại trong một cụm có thể dễ dàng loại bỏ"". Để chứng minh Clio hoạt động, nhóm nghiên cứu đã sử dụng robot bốn chân Spot của Boston Dynamics chạy Clio để khám phá một tòa nhà văn phòng và thực hiện một loạt nhiệm vụ. Làm việc trong thời gian thực, Clio đã tạo ra một bản đồ ảo chỉ hiển thị các vật thể liên quan đến nhiệm vụ của nó, sau đó cho phép robot Spot hoàn thành mục tiêu của mình. Chó robot: Ảnh: Andy Ryan Robot còn có thể nhìn, hiểu và làm theo. Các nhà nghiên cứu đã đạt được mức độ chi tiết này với Clio bằng cách kết hợp các mô hình ngôn ngữ lớn (LLM) - nhiều mạng nơ-ron ảo làm nền cho các công cụ, hệ thống và dịch vụ trí tuệ nhân tạo - đã được đào tạo để xác định tất cả các loại vật thể, với thị giác máy tính. Bước đột phá mà Clio mang đến là khả năng chi tiết với những gì nó nhìn thấy trong thời gian thực, liên quan đến các nhiệm vụ cụ thể mà nó được giao. Một phần cốt lõi của điều này là kết hợp một công cụ lập bản đồ vào Clio cho phép nó chia một khung cảnh thành nhiều phân đoạn nhỏ. Sau đó, một mạng nơ-ron chọn ra các phân đoạn tương tự về mặt ngữ nghĩa - nghĩa là chúng phục vụ cùng một mục đích hoặc tạo thành các vật thể tương tự. Trong tương lai, nhóm nghiên cứu có kế hoạch điều chỉnh Clio để xử lý các nhiệm vụ ở cấp độ cao hơn. ""Chúng tôi vẫn đang giao cho Clio những nhiệm vụ cụ thể, chẳng hạn như 'tìm bộ bài',"" Maggio nói. ""Đối với tìm kiếm và cứu hộ, bạn cần giao cho nó những nhiệm vụ ở cấp độ cao hơn, chẳng hạn như 'tìm người sống sót' hoặc 'khôi phục điện."" Vì vậy, chúng tôi muốn đạt được sự hiểu biết ở cấp độ con người hơn về cách hoàn thành các nhiệm vụ phức tạp hơn. Minh Thư (Theo Live Science)"
Thép không gỉ có thành phần gì đặc biệt?                        ,https://vnexpress.net/thep-khong-gi-co-thanh-phan-gi-dac-biet-4790242.html                         ,"Thành phần hóa học đặc biệt trong thép không gỉ tạo ra lớp bảo vệ trên bề mặt của nó, ngăn oxy tiếp xúc với sắt và gây han gỉ."                                                                                                    ,"Thép không gỉ có nhiều ứng dụng trong ngành thực phẩm, y tế và nhiều lĩnh vực khác. Ảnh: Wordpress Thành phần hóa học của thép không gỉ ngăn oxy trong không khí và môi trường tiếp xúc với sắt trong thép, qua đó chặn phản ứng oxy hóa có hại. Thép thường han gỉ khi sắt phản ứng với oxy, hình thành oxit sắt. Dù gỉ sắt không gây hại cho con người, nó có thể ăn mòn sắt khiến vật liệu kém an toàn và xấu hơn. Thép thường là hợp kim chứa 99% sắt và khoảng 0,2 - 1% carbon, trong khi thép không gỉ thường chứa khoảng 62 - 75% sắt, 1% carbon, và hơn 10,5% crom. Thép không gỉ cũng chứa vài phần trăm nickel, giúp vật liệu bền và dễ xử lý hơn. Crom đóng vai trò chủ chốt giúp chống han gỉ ở thép không gỉ, theo nhà khoa học vật liệu Tim Collins, tổng thư ký của Worldstainless, tổ chức phi lợi nhuận ở Bỉ cộng tác với Hiệp hội thép thế giới. Crom phản ứng với oxy trong môi trường, cả trong không khí và dưới nước, tạo ra lớp oxit crom (Cr2O3) thụ động trên bề mặt kim loại. Lớp này ngăn oxy tiếp xúc với sắt trong thép và tạo ra gỉ sắt, Collins giải thích. Lớp thụ động trên thép không gỉ chỉ dày vài nanomet và không thể nhìn thấy. Lớp oxit crom cũng tự lành nếu bị phá hủy. Nó trơ, không phản ứng hóa học với hợp chất khác và không rò rỉ ra bên ngoài, do đó thép không gỉ rất phù hợp với sản xuất thực phẩm, phẫu thuật và nhiều ứng dụng khác. Thép không gỉ được phát triển vào năm năm 1912 bởi chuyên gia luyện kim người Anh Harry Brearle khi nghiên cứu hợp kim thép để ngăn ăn mòn trong nòng súng. Brearley tạo ra một hợp kim từ sắt, carbon, crom và nickel nhưng nó không phù hợp với nòng súng nên ông vứt ra sau nhà. Sau vài tuần, Brearley nhận thấy hợp kim trong sân không bị han gỉ nên phát triển vật liệu và giới thiệu sản phẩm vào năm 1915. Theo Collins, thép không gỉ hiện nay chiếm khoảng 4% thép sử dụng trên khắp thế giới mỗi năm, gần 2 tỷ tấn. Nhưng sản xuất thép không gỉ rất phức tạp và tốn kém, gấp 3 - 5 lần chi phí sản xuất của thép thường và bao gồm thành phần kim loại đặc biệt trong hợp kim (như molybdenum để ứng dụng dưới nước) khiến nó càng đắt hơn. Kết quả là phần lớn ứng dụng cần thép sử dụng thép thường hoặc thép carbon. An Khang (Theo Live Science)"
Sản xuất nước mắm bằng năng lượng mặt trời năng suất tăng 20%   ,https://vnexpress.net/san-xuat-nuoc-mam-bang-nang-luong-mat-troi-nang-suat-tang-20-4778222.html    ,"Quảng NamThấy công nghệ chế biến nước mắm sử dụng năng lượng mặt trời hiệu quả, anh Lê Văn Lợi đầu tư hơn 2 tỷ đồng triển khai."                                                                                                   ,"Ngày đầu tháng 8, 15 bể chượp (bể muối nước mắm) được anh Lê Văn Lợi, xã Tam Thanh, TP Tam Kỳ muối đầy cá cơm. Khác với cách ướp truyền thống, anh sử dụng công nghệ năng lượng mặt trời và hệ thống náo đảo tự động. Anh là người đầu tiên ở Quảng Nam áp dụng công nghệ này vào sản xuất nước mắm. Anh Lê Văn Lợi, Giám đốc hợp tác xã Nông nghiệp và kinh doanh dịch vụ Cát Trắng kiểm tra bể muối. Ảnh: Đắc Thành Sinh ra trong gia đình làm nước mắm truyền thống ở xã bãi ngang Tam Thanh hơn 100 năm. Thế hệ cha ông của anh Lợi cho cá vào bể sành, xứ, xi măng muối và thường xuyên phơi đảo. Sau 15 tháng muối để thu nước mắm người dân chiết lọc qua vải mất thời gian và không hợp vệ sinh. Năm 2021, anh Lợi biết Trung tâm Ứng dụng tiến bộ Khoa học và Công nghệ Hà Tĩnh đã nghiên cứu, hoàn thiện công nghệ năng lượng mặt trời và hệ thống náo đảo tự động nâng cao hiệu quả sản xuất nước mắm truyền thống. Sau khi tìm hiểu, anh thành lập hợp tác xã Nông nghiệp và Kinh doanh dịch vụ Cát Trắng. Hợp tác xã được Sở Khoa học và Công nghệ Quảng Nam giao thực hiện dự án ""Chuyển giao, ứng dụng tiến bộ khoa và công nghệ thúc đẩy phát triển kinh tế xã hội nông thôn, miền núi và xây dựng dựng nông thôn mới"". Ngoài hỗ trợ của nhà nước, anh Lợi đầu hơn 1 tỷ đồng mua sắm thiết bị và dây chuyền chiết lọc, đóng gói sản phẩm, còn kỹ thuật chế biến được Trung tâm Ứng dụng tiến bộ khoa học và công nghệ Hà Tĩnh chuyển giao. Hệ thống muối cá rộng gần 1.000 m2 dựng lên trong vườn nhà. Cá cơm được đánh bắt từ biển về, anh trộn đều với muối cho vào bể ủ. So với cách muối truyền thống 3 cá một muối, với công nghệ này tỷ lệ bốn cá một muối. Tại mỗi bể được đấu nối hệ thống đường ống để nước mắm chảy tuần hoàn qua máy nước nóng duy trì 40 độ C bằng năng lượng mặt trời. Cá cơm trộn đều với muối với bốn cá một muối. Ảnh: Đắc Thành Quá trình muối, nước mắm chảy từ bể chứa qua hệ thống nước nóng liên tục. Việc này giúp gia tăng nhiệt độ đồng đều trong bể và tăng bề mặt tiếp xúc giữa hệ enzyme và các vi sinh vật với nguyên liệu cá muối trong bể. Chúng được đảo tự động mà không cần sức người. Hệ thống cấp nhiệt có tính ổn định cao, khắc phục được những khó khăn do thời tiết. Chủ cơ sở cho biết, trước đây muối nước mắm cho vào thùng dung tích nhỏ và bịt nắp kín. Để nước mắm đều, thơm ngon người dân mở nắp phải quấy đảo thường xuyên giữa trời nắng. Cách này làm tốn công sức và không hợp vệ sinh, nhiều lúc côn trùng bay vào. ""Từ ngày áp dụng công nghệ này vào sản xuất tiện lợi rất nhiều. Chúng được quấy đảo tự động hoàn toàn khép kín không cần đến sức người. Quá trình sản xuất không phụ thuộc thời tiết, không phải mở nắp thùng để phơi nắng, không lo đậy nắp khi trời mưa"", anh Lợi nói, thêm rằng lượng cá muối trong rất lớn. Mỗi bể chứa hơn 2,5 tấn cá, trong khi muối thủ công mỗi bể được vài tạ cá. Dây chuyền đóng gói tự động được anh Lợi đầu tư. Ảnh: Đắc Thành Theo anh Lợi, công nghệ mới giúp hợp tác xã tiết kiệm diện tích sản xuất, nhà xưởng, đảm bảo yếu tố an toàn vệ sinh thực phẩm, không gây ô nhiễm và tác động đến môi trường như mùi đặc trưng của mắm. Quá trình muối được khép kín, không mở nắp bay hơi. ""So với truyền thống công nghệ này rút ngắn thời gian ủ muối. Phương pháp truyền thống 15-17 tháng mới thu nước mắm nhưng công nghệ này 8-10 tháng có thể thu, rút ngắn được gần nửa thời gian. Lượng nước mắm thu về tăng hơn 20% so với truyền thống và màu sắc đẹp hơn"", anh nói. Trung bình 1 tấn cá sản xuất được 750 lít nước mắm, trong khi với phương pháp truyền thống 1 tấn cá khoảng 650 lít nước mắm. Ứng dụng công nghệ mới, mỗi năm anh Lợi thu hơn 20.000 lít, giá bán từ 80.000 - 110.000 đồng lít. Sản phẩm của hợp tác xã được công nhận OCOP 4 sao. Đắc Thành"
Jotun cung cấp bốn ngành hàng bao gồm: sơn công nghiệp          ,sơn hàng hải                                                                                       ,sơn tĩnh điện và sơn trang trí                                                                                                                                                                                                      ,mang đến giải pháp tổng thể về sơn cho hàng triệu tác phẩm kiến trúc và ngôi nhà trên toàn thế giới.
Vào Việt Nam từ những năm 1993                                  ,Jotun trở thành một trong những thương hiệu sơn được tin dùng tại thị trường                       ,góp phần bảo vệ và làm đẹp cho hàng triệu ngôi nhà gia đình Việt.
Hệ thống dù giúp máy bay gặp nạn hạ cánh an toàn                ,https://vnexpress.net/he-thong-du-giup-may-bay-gap-nan-ha-canh-an-toan-4721192.html                ,"MỹTừ khi đi vào hoạt động, hệ thống dù Cirrus Airframe đã giúp cứu sống 249 người trên những máy bay bị trục trặc động cơ hoặc gặp sự cố bất ngờ."                                                                                 ,"Hệ thống dù Cirrus Airframe giúp máy bay hạ thấp độ cao ở tư thế thăng bằng và tiếp đất an toàn. Ảnh: Smithsonian Magazine Hệ thống dù Cirrus Airframe (CAPS) của công ty Mỹ Cirrus Aircraft đã góp phần thay đổi thay đổi việc di chuyển bằng máy bay nhỏ, theo Simple Flying. Ý tưởng sử dụng dù cho cả máy bay đã tồn tại từ những ngày đầu của ngành hàng không với nhiều nỗ lực thiết kế, dù chưa có sản phẩm nào chứng minh được độ thiết thực hoặc hiệu quả. Hồi tháng 3/2023, trong một tai nạn nghiêm trọng, CAPS đã cứu mạng 6 người trên máy bay Cirrus SR22, bao gồm một em bé 3 tuổi và một bé sơ sinh. Không lâu sau khi cất cánh từ sân bay Pampulha ở Brazil, máy bay bị hỏng động cơ. Nhận thấy tầm chao liệng không đủ để quay trở lại sân bay, phi công quyết định triển khai CAPS. Kết quả là SR22 bay bằng dù trong không trung và tiếp đất an toàn mà không có hành khách nào bị thương. Trước đó năm 1982, công ty Ballistic Recovery Systems (BRS) tạo ra đột phá khi bắt tay vào sản xuất dù cho máy bay siêu nhẹ. Theo Cirrus Aircraft, cột mốc quan trọng diễn ra vào năm 1993 khi BRS phát triển một hệ thống dù chuyên dụng dành cho máy bay Cessna 150/152. Tuy nhiên, hệ thống mở rộng này rất đắt đỏ, nặng nề và chiếm nhiều diện tích để hành lý. Là kết quả hợp tác giữa Cirrus Aircraft và BRS vào thập niên 1990, CAPS đem đến thay đổi lớn về độ an toàn. CAPS là một lưới an toàn tích hợp được thiết kế để triển khai trong tình huống khẩn cấp mà các phương pháp truyền thống có thể không phù hợp. Hệ thống dù CAPS bao trùm toàn bộ khung máy bay, chuyên dùng cho dòng máy bay hạng nhẹ như SR20, SR22, và Vision SF50. CAPS được cấp phép bởi Cục quản lý Hàng không Liên bang Mỹ (FAA) vào tháng 10/1998. Cho tới nay, đây vẫn là dù đạn đạo đầu tiên và duy nhất được sử dụng như trang bị tiêu chuẩn trên máy bay. Khi gặp trục trặc động cơ hoặc đối mặt với thách thức bất ngờ trong chuyến bay, phi công có thể kích hoạt hệ thống dù một cách đơn giản bằng cách kéo cần điều khiển trong buồng lái. Hành động này sẽ kích hoạt tên lửa đẩy dù bung ra giữa không trung, kéo theo toàn bộ máy bay. Hệ thống dù bung ra có kiểm soát, đảm bảo máy bay bay thấp dần với hai cánh thăng bằng, cuối cùng đậu an toàn trên mặt đất hoặc mặt nước. Trang bị an toàn này thu hút nhiều sự chú ý nhờ khả năng giảm thiểu mức độ nghiêm trọng của các trường hợp khẩn cấp. Theo New York Post, CAPS đã cứu sống 249 người. An Khang (Theo Simple Flying)"
'Lão nông' sẵn sàng chia sẻ bí quyết nuôi tôm cho nhân viên     ,https://vnexpress.net/lao-nong-san-sang-chia-se-bi-quyet-nuoi-tom-cho-nhan-vien-4692878.html       ,"Bình ĐịnhÔng Nguyễn Ngọc Châu, 67 tuổi, huyện Phù Cát là người tiên phong áp dụng công nghệ mới vào nuôi tôm, cũng như sẵn sàng chia sẻ kinh nghiệm nuôi trồng để nhân viên ra khởi nghiệp."                                       ,"- Cơ duyên nào đưa ông đến với nghề nuôi tôm? - Năm 2010, tôi bắt đầu nuôi tôm thẻ chân trắng thâm canh với diện tích 8,2 ha. Lúc đó chập chững bước vào nghề, tôi cũng giống như nhiều người khác, phần lớn phụ thuộc vào trời đất. Qua vài vụ nuôi, các vụ tôm đối mặt với dịch bệnh và ô nhiễm môi trường nước. Tôi tìm kiếm thông tin, học hỏi và thay đổi dần kỹ thuật nuôi trồng. Ban đầu tôi sử dụng công nghệ xử lý và lắng đọng nước trước khi nuôi, kế đó là xử lý an toàn khi đưa ra ngoài để đảm bảo môi trường. Nhờ công nghệ Semi - Biofloc giúp cải thiện chế độ dinh dưỡng, lọc nước... trong ao nuôi, đảm bảo an toàn với mức độ cao. Hiện tôi có 3 ha ao nuôi áp dụng công nghệ này, gắn hệ thống đèn LED trong các ao nuôi, thiết lập hệ thống máy móc hỗ trợ và 5 ha nuôi bán thâm canh. Hệ thống ao nuôi tôm thẻ chân trắng theo công nghệ Semi - Biofloc. Ảnh: Ngọc Tùng - Việc ap dụng công nghệ mới tạo ra hiệu quả ra sao? - Công nghệ này giúp người nuôi điều chỉnh được các vấn đề trong quá trình nuôi để giảm thiểu dịch bệnh và ô nhiễm, giúp tôm phát triển và khả năng thành công cao hơn. Tuy nhiên, việc áp dụng công nghệ phải đi kèm với người nuôi phải am hiểu kỹ thuật, kết hợp kinh nghiệm với nhiều yếu tố khác. Riêng bản thân tôi, với quy mô diện tích lớn như thế này, tôi thuê nhiều kỹ sư có chuyên môn cao trong lĩnh vực nuôi trồng thủy sản đánh giá, rà soát ở các hồ. Họ có kỹ thuật, am hiểu công nghệ để triển khai, đồng thời bản thân tôi cũng phải tìm tòi, trau dồi nhiều kiến thức cũng như kinh nghiệm tích luỹ nhiều năm qua thì mới thành công được. Điều quan trọng nhất là tôi kết hợp nhiều yếu tố để đảm bảo độ thành công ở mức cao nhất. - Quá trình nuôi tôm của ông có gặp các khó khăn? - Đến lúc này tôi có 13 năm gắn bó với nghề nuôi tôm. Để có được thành quả như hôm nay, tôi cũng trải qua nhiều thất bại. Năm 2016, tôi bắt đầu chuyển đổi dần các ao nuôi sang công nghệ Semi - Biofloc. Sự chuyển đổi bắt đầu do ô nhiễm nguồn nước nuôi và dịch bệnh trong giai đoạn 2015-2016. Từ khi áp dụng công nghệ mới, việc nuôi mới đạt được sự ổn định. Tuy nhiên, năm 2022, tôi gặp thất bại do các ao nuôi bằng công nghệ mới lẫn ao nuôi bán thâm canh đều bị nhiễm EHP, tôm bỏ ăn trong vòng một tuần rồi chết hàng loạt, lỗ gần 5 tỷ đồng. Nguyên nhân xuất hiện bệnh EHP là mầm bệnh từ bên ngoài xâm nhập vào qua hoạt động vận chuyển từ bên ngoài và khu nuôi. Hiện toàn bộ ao, tôi lắp đặt hệ thống camera giám sát, khử khuẩn, hạn chế tối đa các tác nhân bên ngoài. Chính vì vậy, dù áp dụng công nghệ mới những rủi ro vẫn luôn tiềm ẩn, nên người nuôi tránh chủ quan và việc nuôi tôm phải tỉ mỉ từng khâu. - Ông làm gì để khuyến khích nhân viên gắn bó với công việc này? - Công ty hiện có 35 lao động, chủ yếu là người dân địa phương. Các lao động được trả lương cứng khoảng 6 triệu đồng mỗi tháng và có đi kèm chế độ ăn ở, sinh hoạt và một số phụ cấp khác. Ngoài ra, tôi còn chia sẻ lợi nhuận với nhân viên trên từng ao nuôi. Cụ thể, mỗi ao tôm sau mỗi vụ nuôi tôi trích 5% lợi nhuận chia lại cho từng nhân viên. Tôi làm điều này để khích lệ nhân viên, giúp cho họ có trách nhiệm hơn trong việc chăm sóc tôm. Nếu tỷ lệ tôm đạt yêu cầu cao (18-25 con có trọng lượng 1 kg), lợi nhuận thu về tốt, người phụ trách các ao tôm này sẽ được nhận nhiều hơn. Mọi thông tin đầu tư, lời lỗ của công ty đều được công khai đến mọi người. Chính vì vậy, người lao động coi ao tôm là nơi thân thiết. Nên tôi yên tâm khi giao hồ tôm cho các nhân viên quản lý. Ở góc độ tình cảm, mình đảm bảo cả lợi ích vật chất, sống với anh em chân thành thì sẽ nhận được nhiều hơn là ""lỗ"". Nhân viên thu hoạch tôm tại đầm. Ảnh: Ngọc Tùng - Tại sao ông sẵn sàng chia sẻ kinh nghiệm cho các nhân viên cũng như động viên họ khởi nghiệp? - Tôi vốn làm nghề đóng tàu biển và kinh doanh xăng dầu, từng có giai đoạn làm ăn cực thịnh. Nhưng vì nhiều lý do, gia đình tôi vướng vào cảnh thua lỗ, mất hết tài sản ở tuổi 50. Ở tuổi đó rất khó để gượng dậy. Nhưng trời thương và người thương, gia đình ủng hộ nên tôi vẫn vực lại được kinh tế. Càng lớn tuổi, càng hiểu và tiếp xúc nhiều, tôi thấy rằng bản thân phải có trách nhiệm và chủ động chia sẻ lợi ích với nhau thì phát triển mới bền vững. Khi chuyển hướng nuôi tôm tôi học hỏi kinh nghiệm từ nhiều người nên khi thành công, không có lý gì tôi lại giữ riêng cho mình, ai có nhu cầu học hỏi tôi chỉ hết, cặn kẽ từng ly từng tý. Nhiều nhân viên khi làm việc đủ lâu, nhận thấy năng lực của họ, tôi đều khuyến khích họ mạnh dạn ra làm riêng, cần hỗ trợ gì thì tôi giúp. Như là trả nghĩa với đời và tôi thấy mình rất hạnh phúc. Quang Bảo - Bùi Toàn Ông Nguyễn Ngọc Châu hiện Giám đốc Công ty TNHH Ngọc Châu. Năm 2018, ông được Chủ tịch UBND tỉnh Bình Định tặng bằng khen về thành tích xuất sắc trong phong trào Người cao tuổi làm kinh tế giỏi giai đoạn 2012-2017, góp phần phát triển kinh tế xã hội của tỉnh."
