title                                                           ,url                                                                                                ,description                                                                                                                                                                                                                         ,content
Nuôi lươn không cần bùn và thay nước                            ,https://vnexpress.net/nuoi-luon-khong-can-bun-va-thay-nuoc-4629423.html                            ,"Thạc sĩ Lê Ngọc Hạnh nghiên cứu công nghệ nuôi lươn không bùn trong bể tuần hoàn không cần thay nước, rút ngắn thời gian nuôi tới 2 tháng."                                                                                        ,"Năm 2011, thạc sĩ Hạnh, Viện nghiên cứu nuôi trồng thủy sản 2 tham gia dự án nuôi cá tra bằng công nghệ tuần hoàn do Đại học Wageningen (Hà Lan) tài trợ. Trong 3 năm triển khai, anh suy nghĩ hướng ứng dụng nguyên lý tuần hoàn cho các loài thủy sản khác như lươn, cua... Năm 2014, anh xây dựng quy trình nuôi lươn không bùn bằng hệ thống tuần hoàn khép kín, sử dụng hệ thống xử lý nước để tạo môi trường tốt nhất cho lươn lớn nhanh. Hệ thống gồm bể nuôi diện tích khoảng 4 m2 (đường kính 2 m), được thiết kế hình vuông cạnh bo tròn để đảm bảo hiệu quả việc tuần hoàn nước trên khắp bề mặt và diện tích nuôi tối đa. Bể nuôi còn có các giá thể như lưới, sợi nhựa... để lươn có điểm tựa trú ẩn và ngoi lên hô hấp trên mặt nước. Hệ thống xử lý nước gồm lọc cơ học và lọc vi sinh giúp loại bỏ phân thải, thức ăn dư thừa trong nước. Các khí độc hòa tan trong nước được xử lý sinh học bằng các giá thể. Hệ thống tuần hoàn có các thiết bị bổ trợ, cung cấp oxy, diệt khuẩn bằng đèn UV và thiết bị khử màu bằng cát giúp nước có màu sắc trong hơn. Lươn phát triển sau một tháng bằng công nghệ nuôi không bùn sử dụng hệ thống tuần hoàn tại trại thực nghiệm của Trung tâm khuyến nông và dịch vụ nông nghiệp Tiền Giang. Video: NVCC Theo thạc sĩ Hạnh, nuôi lươn truyền thống phải thay nước 1 - 2 lần mỗi ngày. Nuôi lươn tuần hoàn sẽ không cần làm việc này trong suốt quá trình nuôi. Người nuôi chỉ cần bổ sung lượng nước nhỏ để bù vào do bốc hơi hoặc rò rỉ đường ống. Điều này giúp nông dân tiết kiệm khối lượng nước lớn mỗi vụ nuôi, giảm công lao động. Ngoài ra, hệ thống tuần hoàn sẽ giúp môi trường sống của lươn luôn sạch, tính ổn định cao hơn so với phương thức nuôi thay nước. Lý do, việc thay nước sẽ làm xáo trộn môi trường sống của lươn, ảnh hưởng đến khả năng sinh trưởng của chúng. ""Nuôi thay nước có thể mất 10 - 15 tháng để thu hoạch. Công nghệ tuần hoàn chỉ cần 8 - 10 tháng"", anh Hạnh nói. Ngoài ra, nông dân hiện nay nuôi lươn chủ yếu sử dụng nước giếng khoan, có thể tồn dư một số chất độc nếu không được xử lý sẽ ảnh hưởng đến tốc độ lớn của lươn. Sơ đồ hoạt động của mô hình 8 bể nuôi. Ảnh: NVCC Vì sử dụng hệ thống lọc, cung cấp oxy, diệt khuẩn nên công nghệ tuần hoàn sẽ tốn điện gấp khoảng 3 lần so với nuôi lươn thay nước. Tuy nhiên, theo thạc sĩ Hạnh, công nghệ này cho phép nuôi mật độ tăng tối đa gấp 5 lần trên cùng một diện tích và thời gian rút ngắn nên có thể bù đắp chi phí về điện. Thiết kế bể thông thường ở đường kính khoảng 2 m với diện tích khoảng 4 m2. Mỗi bể có thể thả 2.000 con giống (khoảng 500 con mỗi m2), có thể thu 400 - 500 kg lươn thịt và có thể tăng mật độ để nâng cao năng suất. Lợi nhuận nuôi lươn ước tính 20%, tức mức đầu tư mỗi kg lươn khoảng 100.000 đồng thì giá bán ra bình quân khoảng 120.000 đồng. Chi phí đầu tư thiết bị nuôi tuần hoàn quy mô nuôi 5 tấn khoảng 400 triệu đồng. Ở quy mô này, mỗi vụ nông dân thu lãi khoảng 100 triệu đồng. Như vậy, nuôi 3 - 4 vụ sẽ thu hồi vốn nếu chưa tính chi phí con giống. ""Đây không phải là giải pháp làm giàu nhanh, nhưng công nghệ này bền vững, phù hợp nông nghiệp đô thị hạn chế về không gian, nguồn nước"", anh Hạnh nói. Thiết bị lọc cơ học của hệ thống. Ảnh: NVCC Hồi tháng 3/2021, mô hình nuôi lươn không bùn trong bể tuần hoàn được thử nghiệm tại Trung tâm khuyến nông và dịch vụ nông nghiệp Tiền Giang, quy mô 4 bể nuôi diện tích khoảng 4,8 m2 mỗi bể. Mô hình thử nghiệm với nhiều mật độ khác nhau để đánh giá, năng suất đạt trung bình 50 kg lươn mỗi m2. Theo ông Nguyễn Tấn Quốc, Giám đốc Trung tâm, quá trình nuôi thử nghiệm đạt hiệu quả bước đầu khi không cần thay nước nhưng lươn vẫn phát triển tốt, tăng trưởng nhanh trong tháng đầu tiên. ""Với mô hình này, chi phí đầu tư không quá lớn nhưng có thể tạo sinh kế cho người dân không có điều kiện mặt bằng rộng hoặc khu vực khan hiếm nước sạch cũng có thể triển khai"", ông Quốc nói. Hà An"
Không tiêu đề                                                   ,https://vnexpress.net/ai-tu-co-may-tu-hanh-den-cong-nghe-cuoc-song-4629804.html                    ,Không có mô tả                                                                                                                                                                                                                      ,
Thạc sĩ chế tạo xúc tác nano vàng khử chất độc trong nước thải  ,https://vnexpress.net/thac-si-che-tao-xuc-tac-nano-vang-khu-chat-doc-trong-nuoc-thai-4624074.html  ,"TP HCMThạc sĩ Hồ Gia Thiên Thanh, 26 tuổi, nghiên cứu xúc tác nano vàng khử chất độc p-nitrophenol có trong nước thải thành không độc, ứng dụng cho ngành dược."                                                                   ,"Thanh hiện làm việc tại Phòng Quá trình thiết bị và xúc tác, Viện Công nghệ Hóa học, Viện Hàn lâm Khoa học và Công nghệ Việt Nam. Từ cuối năm 2022, Thanh nghiên cứu, đề xuất quy trình chế tạo xúc tác nano vàng bằng phương pháp xanh mang tên ceria dạng thanh nano ứng dụng để khử p-nitrophenol (PNP) trong nước thải. PNP là hợp chất hữu cơ gây độc có trong nước thải các ngành nhuộm, dược, chế biến thực phẩm... Cơ quan Bảo vệ Môi trường Hoa Kỳ đã phân loại nó trong 114 chất ô nhiễm hữu cơ nguy hiểm nhất và có khả năng gây ung thư. Phương pháp xử lý p-nitrophenol của Thanh là sử dụng xúc tác để chuyển gốc nitro thành gốc amine, nghĩa là chuyển PNP thành p-aminophenol (PAP). Với PAP thu được có thể làm tiền chất dùng trong dược phẩm, như bào chế thuốc paracetamol. Thạc sĩ Hồ Gia Thiên Thanh tại phòng thí nghiệm Viện Công nghệ Hóa học, Viện Hàn Lâm Khoa học và Công nghệ Việt Nam (quận 12, TP HCM). Ảnh: Hà An Tác giả cho biết, với các nghiên cứu truyền thống, việc chế tạo nano vàng thường sử dụng chất khử hóa học như Natri borohydride (NB), có độc tính và chi phí cao. Để thay thế chất khử NB này, Thanh sử dụng dịch chiết vỏ bưởi chứa nhiều hợp chất polyphenol có khả năng khử các ion vàng thành hạt nano vàng. Ngoài ra, để tăng hiệu quả chuyển PNP thành PAP, tác giả sử dụng ceria dạng thanh nano làm chất mang giúp phân tán các hạt nano vàng. Từ đó giảm thời gian xử lý từ một giờ xuống 30 phút. ""Phương pháp này giúp quá trình khử PNP xanh hơn, tiết kiệm chi phí và tận dụng nguồn phụ phẩm tự nhiên"", Thanh cho biết. Với hàm lượng hạt nano vàng từ 0,1 đến 0,2% trên chất mang ceria, xúc tác nano vàng làm việc hiệu quả, quá trình khử PNP có thể đạt hiệu suất trên 99% trong quy mô phòng thí nghiệm. Sau 5 mẻ thử nghiệm, xúc tác vẫn giữ được hoạt tính và hiệu suất nên giảm nhiều chi phí. Sau mỗi mẻ xử lý, xúc tác sẽ được tách ra bằng phương pháp ly tâm và sử dụng cho mẻ tiếp theo. Tác giả cho biết, chưa tính toán được hiệu suất thu hồi PAP là tiền chất có ích trong ngành dược do đang ở giai đoạn đầu tối ưu quy trình chế tạo và thành phần. Sản phẩm dùng khử PNP có trong nước thải do Thanh nghiên cứu. Ảnh: Hà An Theo TS Nguyễn Trí, Viện Công nghệ Hóa học, Viện Hàn lâm Khoa học và Công nghệ Việt Nam, việc sử dụng xúc tác xử lý PNP thành PAP là hướng nghiên cứu không mới ở trong nước. Tuy nhiên, tính mới của nghiên cứu này là áp dụng phương pháp xanh, sử dụng dịch chiết từ thực vật, cụ thể là vỏ bưởi, phụ phẩm phổ biến cho quá trình tổng hợp nano vàng đính lên chất mang ceria. Với hàm lượng vàng thấp nhưng cho hiệu suất cao và xúc tác có độ bền ổn định. Để hướng đến tính ứng dụng cao hơn, TS Trí cho rằng, tác giả cần chế tạo các xúc tác dạng viên hay đính lên đế mang để dễ thu hồi hơn. Nghiên cứu này cũng cần thử nghiệm ở quy mô lớn hơn với nước thải để đánh giá tác động của các chất khác có trong nước ảnh hưởng đến hiệu suất khử PNP. Nghiên cứu thuộc Chương trình Vườn ươm Sáng tạo trẻ Thành đoàn TP.HCM vừa được nghiệm thu xuất sắc. PGS.TS Nguyễn Thị Phương Phong, Chủ tịch Hội đồng chuyên môn đánh giá cao việc tác giả sử dụng dịch chiết vỏ bưởi để khử muối vàng thành nano vàng, ứng dụng để chuyển từ chất có độc tính thành không độc, ứng dụng cho ngành dược. Các phương pháp xử lý PNP hiện nay chủ yếu dùng công nghệ hấp phụ, nhưng phải qua bước tiếp theo là xử lý chất hấp phụ. Các phương pháp truyền thống khác sử dụng nhiều loại hóa chất gây tốn kém và ảnh hưởng tới môi trường. Hà An"
Tiến sĩ làm robot hai bánh tự cân bằng khi thay đổi độ cao      ,https://vnexpress.net/tien-si-lam-robot-hai-banh-tu-can-bang-khi-thay-doi-do-cao-4623841.html      ,TS Trần Đức Thiện (Đại học Sư phạm Kỹ thuật TP HCM) phát triển robot hai bánh có khả năng tự nâng hạ độ cao của khớp chân nhưng vẫn giữ thăng bằng.                                                                                 ,"TS Thiện (35 tuổi) đang làm việc tại Phòng thí nghiệm Robot và điều khiển thông minh (khoa Điện - Điện tử). Từ cuối năm 2021, anh hướng dẫn nhóm sinh viên làm robot hai bánh tự cân bằng phiên bản đầu tiên. Anh cho biết, robot hai chân có sự linh hoạt hơn bốn chân. Nó có khả năng di chuyển trên nhiều địa hình theo nhiều hướng khác nhau, trong điều kiện không gian chật hẹp. Xu thế hiện nay nhiều doanh nghiệp dùng robot này vận chuyển hàng hóa, thực hiện nhiệm vụ trong môi trường nguy hiểm thay con người... nên tiềm năng ứng dụng cao. Nhóm đã xây dựng mô hình toán học, đưa ra các giải thuật và kiểm chứng hoạt động của robot trên phần mềm mô phỏng. Sau đó triển khai mô hình cơ khí thực tế. Sản phẩm đầu tay là robot tự cân bằng trên hai bánh, nhưng cố định độ cao. Sau phiên bản đầu tiên, TS Thiện tiếp tục nghiên cứu cho robot có thể tự nâng hạ độ cao khớp chân nhưng vẫn giữ thăng bằng, giúp di chuyển linh hoạt hơn. Thử nghiệm hoạt động robot hai bánh tự cân bằng của TS Thiện cùng nhóm nghiên cứu. Video: Hà An Tác giả cho biết, để đáp ứng yêu cầu nâng hạ khớp, cần phải đưa ra giải thuật dựa vào sự thay đổi chiều cao robot để điều chỉnh thông số bộ điều khiển trên máy tính giúp nó có thể giữ thăng bằng, hoạt động ổn định. Việc này được nhóm áp dụng kỹ thuật thông minh, dựa vào sự thay đổi chiều cao của robot để máy tính suy luận đưa ra thông số phù hợp trên bộ điều khiển, giúp nó di chuyển thăng bằng, không bị đổ khi nâng hạ khớp chân. Sau nhiều lần thử nghiệm, nhóm hoàn thiện phiên bản robot hoạt động với vận tốc di chuyển tối đa 0,5 m mỗi giây. Robot được thiết kế cơ khí chủ yếu bằng nhựa PLA trên máy in 3D. Nhờ ba động cơ điện một chiều, trong đó hai động cơ giúp hai chân của robot di chuyển tới, lui, xoay tại chỗ và một động cơ thay đổi chiều cao của khớp chân. Lưng được trang bị cảm biến góc nghiêng để giữ thăng bằng, bộ pin để cung cấp năng lượng cho động cơ. TS Trần Đức Thiện (giữa) cùng các sinh viên tại phòng thí nghiệm Robot và điều khiển thông minh, Đại học Sư phạm Kỹ thuật TP HCM. Ảnh: Hà An Theo Nguyễn Minh Hoàng, thành viên nhóm, trong quá trình làm robot, động cơ nâng hạ chiều cao thường xuyên bị cháy do phải chịu tải lớn. Để khắc phục, nhóm thiết kế hệ thống lò xo ở chân robot để giảm tải cho động cơ, hạn chế sự cố. Để tăng khả năng hoạt động và tính linh hoạt của robot, TS Thiện cho biết, nhóm tiếp tục phát triển sản phẩm có hai chân di chuyển độc lập nhau. Điều này đòi hỏi phải tăng số lượng lên sáu động cơ, gồm hai động cơ điều khiển chiều cao từng chân, hai động cơ điều khiển chân và hai động cơ điều khiển góc nghiêng mỗi chân. Nhóm đặt mục tiêu robot phải mô phỏng gần giống khớp chân con người nhất. ""Làm robot tự cân bằng như việc nuôi một đứa trẻ. Lúc đầu nó rất hay đổ ngã, nhưng khi đứng vững, thăng bằng rồi cần tiếp tục phát triển giai đoạn mới là di chuyển linh hoạt với các yêu cầu khó hơn"", TS Thiện nói. Để sản phẩm ứng dụng thực tế, ông cho rằng, ngoài cơ cấu chuyển động, robot cần được phát triển hệ thống thị giác máy tính, giúp nó tránh được chướng ngại vật trong quá trình di chuyển, quan sát được điều kiện địa hình xung quanh... Ông Lê Trung Hiếu, kỹ sư điện - điện tử, Giám đốc công ty công nghệ Ewater đánh giá cao, sản phẩm là hướng nghiên cứu mang tính nền tảng phục vụ cho việc phát triển các sản phẩm robot hai bánh tự cân bằng ứng dụng sau này trong nhiều lĩnh vực như nông nghiệp, dịch vụ, quân sự... Tuy nhiên, để đưa vào ứng dụng còn phụ thuộc vào việc ""xây dựng thuật toán lập trình, thiết kế cơ khí... đảm bảo khả năng giữ thăng bằng tốt nhất trong nhiều hoàn cảnh thực tế khác nhau"", ông Hiếu nói. Hà An"
Làm chế phẩm sinh học tạo trầm hương trên cây dó bầu            ,https://vnexpress.net/lam-che-pham-sinh-hoc-tao-tram-huong-tren-cay-do-bau-4612831.html            ,"Nhóm sinh viên Đại học Lâm nghiệp nghiên cứu chế phẩm sinh học, sau đó khoan lỗ trên cây dó bầu để tạo trầm hương."                                                                                                                ,"Với mong muốn kích thích trầm hương sinh trưởng thay thế phương pháp thủ công và hóa học, nhóm sinh viên Nguyễn Hoàng Anh, Nguyễn Anh Dũng và Nguyễn Đức Nam tìm cách chọn lọc một số dòng nấm ngoài tự nhiên tạo chế phẩm sinh học. Từ tháng 7/2020 với sự hướng dẫn của TS Nguyễn Thị Hồng Gấm, nhóm nghiên cứu đã chọn lọc được năm dòng nấm có khả năng kích thích tạo trầm hương, gồm: Penecillum, Aspergillus, Trichoderma, Fusarium solani và Mucor. Đây là các chủng nấm có khả năng sinh enzyme cellulase và pectinase ngoại bào tốt trong phòng thí nghiệm. Nhóm nghiên cứu đã phân lập và tạo thành công chế phẩm sinh học có khả năng kích thích sinh trầm hương. Thực nghiệm tại vườn trầm hương tại huyện Hương Khê (Hà Tĩnh) trong 8 tháng nhóm ghi nhận 100% tỷ lệ lỗ khoan tạo trầm trên cây với kích thước vết tạo trầm 2,2 x 36 cm, gỗ tạo trầm có màu đen sẫm và mùi thơm ngát, ngọt, thanh mùi trầm. Các chế phẩm sinh học giúp tăng sinh trầm hương được nhóm phối trộn trong phòng thí nghiệm. Ảnh: NVCC Hiện có nhiều cách tạo trầm hương, bằng thủ công và sử dụng hóa chất. Nguyễn Hoàng Anh, trưởng nhóm cho biết, việc tạo trầm hương tự nhiên bằng các biện pháp thủ công đơn giản, dễ thực hiện nhưng xác suất thành công thấp. Nếu dùng hóa chất hiệu quả cao hơn, có thể tạo được nhiều trầm trong thời gian ngắn, nhưng gây dư thừa các thành phần hóa học độc hại. Loại trầm này cũng không được người dùng ưa chuộng. Do vậy, sử dụng các chủng nấm có khả năng kích thích tạo trầm cấy trực tiếp vào thân cây được đánh giá là khả quan, với các ưu điểm như tỷ lệ thành công cao và không để lại hóa chất độc hại tồn dư trong sản phẩm. Theo Hoàng Anh, các vi sinh vật có khả năng sinh tổng hợp ra nhiều loại enzyme, phân giải các hợp chất cấu tạo nên tế bào gỗ của cây dó bầu. Do vậy cấu trúc tế bào gỗ vững chắc bị phân giải dần từ ngoài thành vào trong. Đặc tính của cây dó bầu là khả năng sinh tổng hợp nên các hợp chất tại các vùng tế bào bị tổn thương. ""Tạo vết thương trên thân dó bầu và truyền chế phẩm sinh học tại vị trí đó sẽ giúp cho việc tạo trầm của cây hiệu quả hơn"", Hoàng Anh nói. Nhóm sẵn sàng chuyển giao kỹ thuật tạo chế phẩm sinh học cho doanh nghiệp để ứng dụng kết quả nghiên cứu vào thực tiễn sản xuất. Lỗ khoan tạo trầm hương tại Hà Tĩnh từ chế phẩm sinh học nhóm tạo được. Ảnh: NVCC TS Nguyễn Thị Hồng Gấm, Viện Công nghệ sinh học Lâm nghiệp (Đại học Lâm nghiệp) đánh giá, ""nghiên cứu của nhóm khá bài bản, có thể ứng dụng ngay"". Các dòng nấm có sẵn trong tự nhiên, được phân lập và nhân lên dùng để kích thích tạo trầm hương hiệu quả hơn. Tuy nhiên, nhược điểm của phương pháp sinh học là cần thời gian dài để kích thích tạo trầm và khối lượng thu được trên cây không nhiều. Hiện cây trầm hương được chia thành 2 loại chính gồm: cây tự nhiên và nhân tạo. Cây trầm hương nhân tạo được hình thành dưới sự tác động của con người. Thông thường những cây dó bầu từ 7 - 10 năm tuổi sẽ được chọn để tiến hành đục và cấy ghép cây. Sau đó, sẽ cần thêm 5 năm để cây dó bầu tạo ra trầm. Tương tự như trầm tự nhiên, trầm hương nhân tạo cũng phải trải qua các quá trình hình thành và tích tụ để tạo nên trầm. Tại Việt Nam, cây dó bầu mọc tự nhiên rải rác trong rừng từ Bắc vào Nam, phân bố tập trung ở các tỉnh Kon Tum, Kiên Giang, Quảng Nam, Đà Nẵng, Quảng Bình, Hà Tĩnh và đảo Phú Quốc. Riêng Hà Tĩnh, đến 2020 có khoảng 3 triệu cây dó bầu, phân bố trên 3.000 ha, mật độ trung bình 1.000 cây mỗi ha với hơn 9.000 hộ dân trồng dó bầu. Hà An"
Sinh viên làm thiết bị chống ngập cho xe máy                    ,https://vnexpress.net/sinh-vien-lam-thiet-bi-chong-ngap-cho-xe-may-4618517.html                    ,"Trần Lê Phước (Đại học Công nghiệp Thực phẩm TP HCM) chế tạo hệ thống ngăn nước vào ống xả, bugi, tách nước và khí… giúp xe máy có thể hoạt động hơn 20 phút khi ngập."                                                            ,"Thời gian đầu vào Sài Gòn nhập học, Phước (sinh viên khoa Điện - điện tử) từng nhiều lần phải dắt bộ xe máy mỗi khi trời mưa lớn, đường ngập. Chứng kiến cảnh nhiều người lớn tuổi, phụ nữ rất vất vả khi phải dắt bộ xe qua chỗ ngập, Phước trăn trở cách khắc phục. Đầu năm 2022, Phước mày mò tìm hiểu nguyên lý hoạt động xe để thiết kế hệ thống chống ngập. Cậu cho rằng bugi và ống xả là hai bộ phận đầu tiên ảnh hưởng việc xe tắt máy. Khi nước vào xe, bugi sẽ bị ảnh hưởng đầu tiên do không đánh lửa. Điều này dẫn đến việc xe tắt máy, khiến nước vào ống xả. Trần Lê Phước (trái) giới thiệu hệ thống chống ngập tích hợp vào xe máy với các sinh viên cùng trường. Ảnh: Hà An Phước nghiên cứu chế tạo nắp chụp bugi làm bằng vật liệu cao su dẻo với thiết kế ôm sát nhằm tăng khả năng chống nước. Ống xả được thay đổi cách hoạt động so với sản phẩm thông thường. Cậu thiết kế theo nguyên lý hộp kín úp ngược vào nước. Khi đó nước sẽ không chảy vào bên trong. Từ nguyên tắc này, Phước chế tạo ống xả có ba khoang khác nhau, có cơ chế hoạt động tương tự nguyên lý úp ngược để áp lực bên trong luôn lớn hơn áp lực bên ngoài. Nước sẽ không vào được bên trong ống xả, hoặc có thì cũng rất ít, khi đầy một khoang mới chảy qua khoang khác. Ống xả sẽ không có lỗ thông hơi như giống các loại xe truyền thống mà gắn một ốc có thể tháo lắp để xả nước, đảm bảo bên trong kín. Theo Phước, việc thiết kế ống xả khác sẽ không ảnh hưởng hoạt động của xe. Để tăng khả năng chống ngập, cậu thiết kế hệ thống tách nước theo dạng ống đặt trước bình xăng của xe. Khi nước ngập qua bình xăng, hệ thống tách nước và không khí sẽ hoạt động nhằm tách nước với khí bên ngoài riêng biệt để không ảnh hưởng đến quá trình hoạt động của máy. Khi nước tách ra sẽ chảy qua khoang chứa được trang bị công tắc cảm biến. ""Lúc có nước, máy bơm một chiều sẽ đẩy nước từ bên trong ra ngoài nhằm ngăn bình chứa nước quá nhiều sẽ bị hút ngược nước vào bên trong buồng đốt"", Phước nói. Với hệ thống này, xe máy đang tắt vẫn có thể khởi động lại khi bị ngập nước. Theo Phước, hệ thống đáp ứng yêu cầu với xe ngập trong hầm chung cư hay khi người dân để xe trong nhà bị ngập. Sản phẩm có thể giúp xe đi qua chỗ ngập không bị tắt máy. Trong trường hợp xe tắt máy, họ chỉ cần dắt lên hết chỗ ngập vẫn có thể khởi động lại chạy bình thường. Tác giả thử nghiệm ngâm động cơ xe trong bồn nước hơn 20 phút vẫn nổ máy. Thử nghiệm hệ thống chống ngập nước trong xe của Phước. Video: NVCC PGS.TS Trương Quang Vinh, chuyên gia điện - điện tử, Phó giám đốc Văn phòng đào tạo quốc tế, Đại học Bách khoa TP HCM đánh giá cao sản phẩm nghiên cứu. Ông cho rằng, sản phẩm có sự hoàn thiện về mô hình xe máy có hệ thống tách nước và khí xả để chống ngập. Thử nghiệm trong bể nước chứng minh sản phẩm hoạt động tốt. Tuy nhiên, theo ông để được ứng dụng thực tế, sản phẩm phải phù hợp trải nghiệm người dùng bởi việc gắn thêm hệ thống mới vào xe sẽ tăng độ cồng kềnh, ảnh hưởng các quy chuẩn về xe máy và nguy cơ mất an toàn. PGS Vinh cho rằng, cần có một cơ quan chuyên môn đánh giá về tính ứng dụng của giải pháp để phù hợp với các tiêu chuẩn kỹ thuật của Việt Nam. Hà An"
